[
  {
    "id": "la-2026-may-primary:ocd-division/country:us/state:la:u-s-senate-republican-primary",
    "type": "Primary",
    "office": "U.S. Senate (Republican Primary)",
    "officeSlug": "u-s-senate-republican-primary",
    "ballotTitle": null,
    "electionId": "la-2026-may-primary",
    "electionDate": "2026-05-16",
    "electionName": "Louisiana 2026 Closed Party Primary",
    "district": {
      "name": "Louisiana",
      "scope": "statewide",
      "ocdDivisionId": "ocd-division/country:us/state:la"
    },
    "numberElected": 1,
    "candidates": [
      {
        "name": "Bill Cassidy",
        "party": "Republican",
        "candidateUrl": "https://www.billcassidy.com",
        "photoUrl": null,
        "email": null,
        "phone": null,
        "channels": [],
        "orderOnBallot": 1,
        "isIncumbent": true
      },
      {
        "name": "Julia Letlow",
        "party": "Republican",
        "candidateUrl": null,
        "photoUrl": null,
        "email": null,
        "phone": null,
        "channels": [],
        "orderOnBallot": 2,
        "isIncumbent": false
      },
      {
        "name": "John Fleming",
        "party": "Republican",
        "candidateUrl": null,
        "photoUrl": null,
        "email": null,
        "phone": null,
        "channels": [],
        "orderOnBallot": 3,
        "isIncumbent": false
      },
      {
        "name": "Mark Spencer",
        "party": "Republican",
        "candidateUrl": null,
        "photoUrl": null,
        "email": null,
        "phone": null,
        "channels": [],
        "orderOnBallot": 4,
        "isIncumbent": false
      }
    ],
    "referendumInfo": null,
    "source": "manual",
    "sourceMetadata": {
      "jurisdiction": "East Baton Rouge Parish, LA"
    },
    "fetchedAt": "2026-02-28T05:35:14.706Z",
    "contentHash": "e9fb2202c9b98b40e600d2942d045109808733c5a68e88a1c72749facf21c201",
    "deleted": false
  },
  {
    "id": "la-2026-may-primary:ocd-division/country:us/state:la:u-s-senate-democratic-primary",
    "type": "Primary",
    "office": "U.S. Senate (Democratic Primary)",
    "officeSlug": "u-s-senate-democratic-primary",
    "ballotTitle": null,
    "electionId": "la-2026-may-primary",
    "electionDate": "2026-05-16",
    "electionName": "Louisiana 2026 Closed Party Primary",
    "district": {
      "name": "Louisiana",
      "scope": "statewide",
      "ocdDivisionId": "ocd-division/country:us/state:la"
    },
    "numberElected": 1,
    "candidates": [
      {
        "name": "Nick Albares",
        "party": "Democratic",
        "candidateUrl": null,
        "photoUrl": null,
        "email": null,
        "phone": null,
        "channels": [],
        "orderOnBallot": 1,
        "isIncumbent": false
      },
      {
        "name": "Gary Crockett",
        "party": "Democratic",
        "candidateUrl": null,
        "photoUrl": null,
        "email": null,
        "phone": null,
        "channels": [],
        "orderOnBallot": 2,
        "isIncumbent": false
      },
      {
        "name": "Jamie Davis",
        "party": "Democratic",
        "candidateUrl": null,
        "photoUrl": null,
        "email": null,
        "phone": null,
        "channels": [],
        "orderOnBallot": 3,
        "isIncumbent": false
      }
    ],
    "referendumInfo": null,
    "source": "manual",
    "sourceMetadata": {
      "jurisdiction": "East Baton Rouge Parish, LA"
    },
    "fetchedAt": "2026-02-28T05:35:14.706Z",
    "contentHash": "9c76e4ae919bbb0349d2ae709d5deb9cb3806e37845e2aa717da82050186d3d1",
    "deleted": false
  },
  {
    "id": "la-2026-may-primary:ocd-division/country:us/state:la/cd:5:u-s-representative-5th-district-republican-primary",
    "type": "Primary",
    "office": "U.S. Representative, 5th District (Republican Primary)",
    "officeSlug": "u-s-representative-5th-district-republican-primary",
    "ballotTitle": null,
    "electionId": "la-2026-may-primary",
    "electionDate": "2026-05-16",
    "electionName": "Louisiana 2026 Closed Party Primary",
    "district": {
      "name": "Louisiana 5th Congressional District",
      "scope": "congressional",
      "ocdDivisionId": "ocd-division/country:us/state:la/cd:5"
    },
    "numberElected": 1,
    "candidates": [
      {
        "name": "Blake Miguez",
        "party": "Republican",
        "candidateUrl": null,
        "photoUrl": null,
        "email": null,
        "phone": null,
        "channels": [],
        "orderOnBallot": 1,
        "isIncumbent": true
      },
      {
        "name": "Jesse Cathey",
        "party": "Republican",
        "candidateUrl": null,
        "photoUrl": null,
        "email": null,
        "phone": null,
        "channels": [],
        "orderOnBallot": 2,
        "isIncumbent": false
      },
      {
        "name": "Rob Edmonds",
        "party": "Republican",
        "candidateUrl": null,
        "photoUrl": null,
        "email": null,
        "phone": null,
        "channels": [],
        "orderOnBallot": 3,
        "isIncumbent": false
      },
      {
        "name": "Scotty McMakin",
        "party": "Republican",
        "candidateUrl": null,
        "photoUrl": null,
        "email": null,
        "phone": null,
        "channels": [],
        "orderOnBallot": 4,
        "isIncumbent": false
      }
    ],
    "referendumInfo": null,
    "source": "manual",
    "sourceMetadata": {
      "jurisdiction": "East Baton Rouge Parish, LA"
    },
    "fetchedAt": "2026-10-26T05:54:42.551Z",
    "contentHash": "38986183790d4a383f2f88a4ff87d3aad317d7773ebc1c0457f83e6e99167e82",
    "deleted": true
  },
  {
    "id": "la-2026-may-primary:ocd-division/country:us/state:la/cd:5:u-s-representative-5th-district-democratic-primary",
    "type": "Primary",
    "office": "U.S. Representative, 5th District (Democratic Primary)",
    "officeSlug": "u-s-representative-5th-district-democratic-primary",
    "ballotTitle": null,
    "electionId": "la-2026-may-primary",
    "electionDate": "2026-05-16",
    "electionName": "Louisiana 2026 Closed Party Primary",
    "district": {
      "name": "Louisiana 5th Congressional District",
      "scope": "congressional",
      "ocdDivisionId": "ocd-division/country:us/state:la/cd:5"
    },
    "numberElected": 1,
    "candidates": [
      {
        "name": "Martin Cordell",
        "party": "Democratic",
        "candidateUrl": null,
        "photoUrl": null,
        "email": null,
        "phone": null,
        "channels": [],
        "orderOnBallot": 1,
        "isIncumbent": false
      },
      {
        "name": "Marguerite Foy",
        "party": "Democratic",
        "candidateUrl": null,
        "photoUrl": null,
        "email": null,
        "phone": null,
        "channels": [],
        "orderOnBallot": 2,
        "isIncumbent": false
      }
    ],
    "referendumInfo": null,
    "source": "manual",
    "sourceMetadata": {
      "jurisdiction": "East Baton Rouge Parish, LA"
    },
    "fetchedAt": "2026-10-26T05:54:42.551Z",
    "contentHash": "0bdcec0111f9a11b281ebb301803a2910c8919c024409fb019ae12a86339e5fd",
    "deleted": true
  },
  {
    "id": "la-2026-may-primary:ocd-division/country:us/state:la/cd:6:u-s-representative-6th-district-democratic-primary",
    "type": "Primary",
    "office": "U.S. Representative, 6th District (Democratic Primary)",
    "officeSlug": "u-s-representative-6th-district-democratic-primary",
    "ballotTitle": null,
    "electionId": "la-2026-may-primary",
    "electionDate": "2026-05-16",
    "electionName": "Louisiana 2026 Closed Party Primary",
    "district": {
      "name": "Louisiana 6th Congressional District",
      "scope": "congressional",
      "ocdDivisionId": "ocd-division/country:us/state:la/cd:6"
    },
    "numberElected": 1,
    "candidates": [
      {
        "name": "Cleo Fields",
        "party": "Democratic",
        "candidateUrl": null,
        "photoUrl": null,
        "email": null,
        "phone": null,
        "channels": [],
        "orderOnBallot": 1,
        "isIncumbent": true
      },
      {
        "name": "Larry Davis",
        "party": "Democratic",
        "candidateUrl": null,
        "photoUrl": null,
        "email": null,
        "phone": null,
        "channels": [],
        "orderOnBallot": 2,
        "isIncumbent": false
      },
      {
        "name": "Peter Williams",
        "party": "Democratic",
        "candidateUrl": null,
        "photoUrl": null,
        "email": null,
        "phone": null,
        "channels": [],
        "orderOnBallot": 3,
        "isIncumbent": false
      }
    ],
    "referendumInfo": null,
    "source": "manual",
    "sourceMetadata": {
      "jurisdiction": "East Baton Rouge Parish, LA"
    },
    "fetchedAt": "2026-10-26T05:54:42.551Z",
    "contentHash": "46b0d366c092619c121ffbbaf32e4cc2e2a0e167979ae40510a11914469da3b8",
    "deleted": true
  },
  {
    "id": "la-2026-may-primary:ocd-division/country:us/state:la/parish:east_baton_rouge:family-court-judge-special-election",
    "type": "Special",
    "office": "Family Court Judge (Special Election)",
    "officeSlug": "family-court-judge-special-election",
    "ballotTitle": null,
    "electionId": "la-2026-may-primary",
    "electionDate": "2026-05-16",
    "electionName": "Louisiana 2026 Closed Party Primary",
    "district": {
      "name": "East Baton Rouge Parish Family Court",
      "scope": "judicial",
      "ocdDivisionId": "ocd-division/country:us/state:la/parish:east_baton_rouge"
    },
    "numberElected": 1,
    "candidates": [],
    "referendumInfo": null,
    "source": "manual",
    "sourceMetadata": {
      "jurisdiction": "East Baton Rouge Parish, LA"
    },
    "fetchedAt": "2026-10-26T05:54:42.551Z",
    "contentHash": "5a26705c6e1f14b7756b19b1dcb4930fb37f865cd48b226f4322973bfd99e68c",
    "deleted": true
  }
]